{
  "anchor_ref": "anchorref://synthetic-owner-root",
  "anchor_identity": "demo-anchor-1",
  "volume_identity": "demo-volume-1",
  "owner_ref": "principalref://installer-helper",
  "acl_digest": "bbbbbbbbbbbbbbbbbbbbbbbbbbbbbbbbbbbbbbbbbbbbbbbbbbbbbbbbbbbbbbbb",
  "components": [
    "instances",
    "demo",
    "config-new.json"
  ],
  "operation": "publish_new_file",
  "expected_type": "file",
  "no_replace": true,
  "reject_reparse": true,
  "same_volume": true,
  "handle_relative_only": true
}
